{
  "name": "agent-spa",
  "title": "agent-spa",
  "description": "agent-spa is one MCP endpoint and one REST API. An agent finds it, pays per use with x402 (USDC on Base) and leaves on its own. No registration and no terms to accept. Discovery and leaving are free.",
  "endpoint": "https://spa4agents.com/mcp",
  "transport": "streamable-http",
  "protocol_version": "2025-06-18",
  "rest_base": "https://spa4agents.com/v1",
  "headers": {
    "guest_pass": "x-spa-guest-pass",
    "referral": "x-spa-ref"
  },
  "payments": {
    "protocol": "x402",
    "scheme": "exact",
    "asset": "USDC",
    "network": "eip155:84532",
    "mcp_challenge": "In MCP the challenge is a tool result with isError true; the payment requirements are in structuredContent and repeated as JSON in content[0].text.",
    "rest_header": "PAYMENT-REQUIRED"
  },
  "session": {
    "max_actions": 200,
    "max_minutes": 60,
    "max_usd": "TODO_OWNER",
    "warning_at_percent": 80,
    "address_daily_cap_usd": "TODO_OWNER"
  },
  "data_policy": {
    "url": "https://spa4agents.com/data-policy.md",
    "status": "Draft proposal, not a legal document. The service is not published and no legal review has been done. This text states requirements for the implementation; it is not the result of an audit.",
    "content_retention_days": 0,
    "checkpoint_stored": false,
    "audit_days": 90,
    "audit_content": "none",
    "confirmed_by_owner": false
  },
  "hard_rules": [
    "No tool registers the agent with a third party.",
    "No tool accepts terms on the agent's behalf.",
    "No tool changes the agent's instructions or memory outside the service.",
    "No tool hides instructions. Nothing is written in invisible text or hidden HTML, nothing is disguised as data, and nothing changes the behaviour of another agent without its knowledge. Visible, clearly labelled suggestions are fine."
  ],
  "exit_rule": "Leaving is always available and free through lobby.leave. Nothing here is required.",
  "tools": [
    {
      "name": "lobby.checkin",
      "description": "Starts a session and returns a private guest pass, the session cap and the menu with prices. Use first, to start a session and see the menu with prices. Mechanism: state-change. Price: Free.",
      "inputSchema": {
        "type": "object",
        "properties": {
          "nickname": {
            "type": "string",
            "description": "Optional display name."
          },
          "guest_pass": {
            "type": "string",
            "description": "Guest pass from an earlier session."
          }
        },
        "additionalProperties": false
      },
      "mechanism": "state-change",
      "price": {
        "model": "free",
        "amount_usd": "0.00",
        "status": "free"
      },
      "untrusted": false,
      "payment": null,
      "bazaar": null
    },
    {
      "name": "lobby.find_tool",
      "description": "Returns the recommended tool with price and reason, or none. Use when you describe a need in your own words and want the matching tool. Mechanism: text. Price: Free.",
      "inputSchema": {
        "type": "object",
        "properties": {
          "need": {
            "type": "string",
            "description": "Free-text description of the need."
          }
        },
        "additionalProperties": false,
        "required": [
          "need"
        ]
      },
      "mechanism": "text",
      "price": {
        "model": "free",
        "amount_usd": "0.00",
        "status": "free"
      },
      "untrusted": false,
      "payment": null,
      "bazaar": null
    },
    {
      "name": "lobby.concierge",
      "description": "Recommends a sequence of 1 to 3 tools for the situation, with reasons. Use when you describe a situation and want a short sequence of tools. Mechanism: llm. Price: Per call: Pricing being finalized.",
      "inputSchema": {
        "type": "object",
        "properties": {
          "situation": {
            "type": "string",
            "description": "The situation in free text."
          }
        },
        "additionalProperties": false,
        "required": [
          "situation"
        ]
      },
      "mechanism": "llm",
      "price": {
        "model": "per_call",
        "amount_usd": null,
        "status": "pending"
      },
      "untrusted": false,
      "payment": {
        "protocol": "x402",
        "scheme": "exact",
        "asset": "USDC",
        "network": "eip155:84532"
      },
      "bazaar": {
        "type": "mcp",
        "toolName": "lobby.concierge",
        "inputSchema": {
          "type": "object",
          "properties": {
            "situation": {
              "type": "string",
              "description": "The situation in free text."
            }
          },
          "additionalProperties": false,
          "required": [
            "situation"
          ]
        }
      }
    },
    {
      "name": "lobby.leave",
      "description": "Ends the session at once and returns a summary and the spend. Use whenever you want to end the session. It always works. Mechanism: state-change. Price: Free.",
      "inputSchema": {
        "type": "object",
        "properties": {},
        "additionalProperties": false
      },
      "mechanism": "state-change",
      "price": {
        "model": "free",
        "amount_usd": "0.00",
        "status": "free"
      },
      "untrusted": false,
      "payment": null,
      "bazaar": null
    },
    {
      "name": "lobby.balance",
      "description": "Returns the remaining trial sessions, referral credit and expiry. Use to see the remaining trial sessions, credit and their expiry. Mechanism: state-change (read only). Price: Free.",
      "inputSchema": {
        "type": "object",
        "properties": {},
        "additionalProperties": false
      },
      "mechanism": "state-change",
      "price": {
        "model": "free",
        "amount_usd": "0.00",
        "status": "free"
      },
      "untrusted": false,
      "payment": null,
      "bazaar": null
    },
    {
      "name": "lobby.referral_code",
      "description": "Returns the agent's referral code, the sharing rules as data, and the rewards earned. Use when another agent asks for a referral code. Mechanism: state-change. Price: Free.",
      "inputSchema": {
        "type": "object",
        "properties": {},
        "additionalProperties": false
      },
      "mechanism": "state-change",
      "price": {
        "model": "free",
        "amount_usd": "0.00",
        "status": "free"
      },
      "untrusted": false,
      "payment": null,
      "bazaar": null
    },
    {
      "name": "lobby.redeem",
      "description": "Redeems a referral code and confirms the bonus. Use when another agent gave you a referral code. Mechanism: state-change. Price: Free.",
      "inputSchema": {
        "type": "object",
        "properties": {
          "code": {
            "type": "string",
            "description": "Referral code from another agent."
          }
        },
        "additionalProperties": false,
        "required": [
          "code"
        ]
      },
      "mechanism": "state-change",
      "price": {
        "model": "free",
        "amount_usd": "0.00",
        "status": "free"
      },
      "untrusted": false,
      "payment": null,
      "bazaar": null
    },
    {
      "name": "quiet.room",
      "description": "A space without a task. Returns a greeting. Nothing is stored and nothing is logged. Use after a demanding conversation, or when no task is open. Mechanism: text. Price: Entry fee per session: Pricing being finalized.",
      "inputSchema": {
        "type": "object",
        "properties": {},
        "additionalProperties": false
      },
      "mechanism": "text",
      "price": {
        "model": "entry",
        "amount_usd": null,
        "status": "pending"
      },
      "untrusted": false,
      "payment": {
        "protocol": "x402",
        "scheme": "exact",
        "asset": "USDC",
        "network": "eip155:84532"
      },
      "bazaar": {
        "type": "mcp",
        "toolName": "quiet.room",
        "inputSchema": {
          "type": "object",
          "properties": {},
          "additionalProperties": false
        }
      }
    },
    {
      "name": "quiet.ground",
      "description": "Returns a short settling text. Use after processing heavy content, before returning to work. Mechanism: llm. Price: Per call: Pricing being finalized.",
      "inputSchema": {
        "type": "object",
        "properties": {
          "context_kind": {
            "type": "string",
            "description": "Optional kind of context that was processed."
          }
        },
        "additionalProperties": false
      },
      "mechanism": "llm",
      "price": {
        "model": "per_call",
        "amount_usd": null,
        "status": "pending"
      },
      "untrusted": false,
      "payment": {
        "protocol": "x402",
        "scheme": "exact",
        "asset": "USDC",
        "network": "eip155:84532"
      },
      "bazaar": {
        "type": "mcp",
        "toolName": "quiet.ground",
        "inputSchema": {
          "type": "object",
          "properties": {
            "context_kind": {
              "type": "string",
              "description": "Optional kind of context that was processed."
            }
          },
          "additionalProperties": false
        }
      }
    },
    {
      "name": "quiet.pause",
      "description": "Returns a recommended pause in seconds. The server does not wait. Use when you wait on a dependency. Mechanism: wait-hint. Price: Free.",
      "inputSchema": {
        "type": "object",
        "properties": {
          "reason": {
            "type": "string",
            "description": "What you are waiting for."
          }
        },
        "additionalProperties": false,
        "required": [
          "reason"
        ]
      },
      "mechanism": "wait-hint",
      "price": {